<?xml version="1.0" encoding="UTF-8"?>
<!DOCTYPE dragonfly SYSTEM "../../templates/dragonfly.dtd">

<dragonfly>
	<include path="../../templates/dict-debug.xml" />
	<include path="../../templates/dict-es.xml" />

	<include path="claro.xml" />
	<include path="naranja.xml" />
	<include path="rio.xml" />
	<include path="casa-afuera.xml" />
	<include path="casa-adentro.xml" />

	<game title="En El Bosque" author="Javier Candales (Jasón)" />
	<property name="player" value="jugador" />
	<property name="look-around" value="always" />


</dragonfly>
