<?xml version="1.0" encoding="UTF-8"?>

<!DOCTYPE dragonfly SYSTEM "./dragonfly.dtd">

<dragonfly>
	<verb names = "info" action = "dragonfly.debug.Info" syntax = "1" />
	<verb names = "tree" action="dragonfly.debug.TreeObject" syntax="1" />
	<verb names = "tree" action = "dragonfly.debug.Tree"/>
	<verb names = "attr, attribute" action = "dragonfly.debug.Attr"
		syntax = "1, set/unset, 2" />
	<verb names = "move, mv" action = "dragonfly.debug.Move" syntax = "1, to, 2" />
	<verb names = "root" action = "dragonfly.debug.Root" syntax = "1" />
	<verb names = "verb" action="dragonfly.debug.VerbInfo" syntax = "1" />
</dragonfly>
