<?xml version="1.0" encoding="UTF-8"?>
<!DOCTYPE dragonfly SYSTEM "../../templates/dragonfly.dtd">

<dragonfly>
	<noun names="En Un Claro, claro">

		<after actions="LookAround">
			<if class="IsSet" instance="claro" attr="described" />
			<response class="Message" style="family: 'Sans'; italic: True">
				Algo me huele raro en éste bosque ...
			</response>
		</after>

		<after actions="LookAround">
			Estoy en un claro donde la luz baña totalmente el sendero. Y dicho camino se extiende de sur a norte.
			<response class="Attr" set="described" instance="claro"/>
		</after>

		<!--<noun names="jugador, player"></noun>-->

		<noun names="sendero, camino, sendero-principal">
			<set>fixed, scene</set>
			
			<after actions="ExamineObject">
				La hierba ha dejado de crecer por el angosto sendero. Debe ser bastante transitado.
			</after>
		</noun>

		<noun names="árboles, arboles-principal, arbol, vegetacion, hierba, hierbas, tronco, troncos, madera">
			<set>plural, fixed, scene</set>

			<after actions="ExamineObject">
				Entre enormes árboles y enmarañada vegetación, es imposible ver y transitar fuera del sendero.
			</after>
		</noun>

		<connection exit="norte" destiny="arbol-naranja" />
		<connection exit="sur" destiny="claro" />
	</noun>
</dragonfly>
